GMID,Dataset,Facility Name,Address,數據集,設施名稱,地址,District,地區,Facility Type,設施種類,Opening Hours,開放時間,Telephone,聯絡電話,Fax Number,傳真號碼,Email Address,電郵地址,Website,網頁,Facility Details,設施詳情,Northing,Easting,Latitude,Longitude,Last Update
"blUhXe01yV","Tennis Courts","Tsing Yi Park","Tsing Luk Street, Tsing Yi","網球場","青衣公園","青衣青綠街","KWAI TSING","葵青","BASKETBALL COURTS,HANDBALL COURTS,HARD-SURFACE PITCHES,OPEN AIR THEATRES,PARK,TENNIS COURTS","籃球場,手球場,硬地球場,露天劇場,公園,網球場","N.A.","N.A.","N.A.","N.A.","N.A.","N.A.","N.A.","N.A.","http://www.lcsd.gov.hk/en/ls_park.php","http://www.lcsd.gov.hk/b5/ls_park.php","7-a-side Soccer Pitch","7人足球場","824116.8","828954.6","22.35616","114.10587","2019-09-18 11:34:07"
"LsymsTBIVj","Tennis Courts","Tsuen King Circuit Playground","Tsuen King Circuit, Tsuen Wan, N.T.","網球場","荃景圍遊樂場","荃灣荃景圍","TSUEN WAN","荃灣","TENNIS COURTS","網球場","N.A.","N.A.","N.A.","N.A.","N.A.","N.A.","N.A.","N.A.","http://www.lcsd.gov.hk/en/facilities/facilitieslist.html","http://www.lcsd.gov.hk/tc/facilities/facilitieslist.html","N.A.","N.A.","826687.2","829001.1","22.37938","114.10631","2009-09-21 17:11:45"
"jebQerJrxW","Tennis Courts","Tsuen Wan Park","59 Wing Shun Street, Tsuen Wan","網球場","荃灣公園","荃灣永順街59號","TSUEN WAN","荃灣","PARK, TENNIS COURTS, GATEBALL COURTS, CYCLING TRACKS/GROUNDS, JOGGING TRACKS/FITNESS TRAILS, OPEN AIR THEATRES, DOG GARDENS/PET GARDENS","公園, 網球場, 門球場, 單車徑/場, 緩跑徑/健身徑, 露天劇場, 狗公園/寵物公園","N.A.","N.A.","N.A.","N.A.","N.A.","N.A.","N.A.","N.A.","http://www.lcsd.gov.hk/en/ls_park.php","http://www.lcsd.gov.hk/b5/ls_park.php","N.A.","N.A.","825329.0","829671.0","22.36711","114.11282","2010-04-08 16:40:08"
"9gHcg77oos","Tennis Courts","Tsuen Wan Riviera Park","2A Yi Hong Street, Tsuen Wan","網球場","荃灣海濱公園","荃灣怡康街2A號","TSUEN WAN","荃灣","PARK, GRASS PITCHES, TENNIS COURTS, BASKETBALL COURTS, VOLLEYBALL COURTS, GATEBALL COURTS","公園, 草地球場, 網球場, 籃球場, 排球場, 門球場","N.A.","N.A.","N.A.","N.A.","N.A.","N.A.","N.A.","N.A.","http://www.lcsd.gov.hk/en/ls_park.php","http://www.lcsd.gov.hk/b5/ls_park.php","11-a-side Natural Grass Soccer Pitch, Basketball cum Volleyball Court","11人天然草地足球場, 籃球場暨排球場","824915.0","829602.0","22.36337","114.11215","2009-07-16 12:13:01"
"4eNCUR8vFd","Tennis Courts","Tuen Mun Tang Shiu Kin Sport Ground Tennis Courts","Tsun Wen Road, Tuen Mun","網球場","屯門鄧肇堅運動場網球場","屯門震寰路","TUEN MUN","屯門","N.A.","N.A.","","","","","","","","","http://www.lcsd.gov.hk/en/facilities/facilitieslist/landsports/tennis.html","http://www.lcsd.gov.hk/tc/facilities/facilitieslist/landsports/tennis.html","N.A.","N.A.","829475.7","815299.4","22.40444","113.97323","2009-07-29 10:47:41"
"BrKVknU86j","Tennis Courts","Tung Chau Street Park","Tung Chau Street, Sham Shui Po","網球場","通州街公園","深水埗通州街","SHAM SHUI PO","深水埗","HARD-SURFACE PITCHES, BASKETBALL COURTS, VOLLEYBALL COURTS, TENNIS COURTS","硬地球場, 籃球場, 排球場, 網球場","N.A.","N.A.","N.A.","N.A.","N.A.","N.A.","N.A.","N.A.","http://www.lcsd.gov.hk/en/facilities/facilitieslist.html","http://www.lcsd.gov.hk/tc/facilities/facilitieslist.html","7-a-side soccer pitch, 5-a-side soccer pitch","7人足球場, 5人足球場","820713.0","834559.0","22.32544","114.16029","2010-05-28 15:41:36"
"miZxcmDeKy","Tennis Courts","Victoria Park","1 Hing Fat Street, Causeway Bay","網球場","維多利亞公園","銅鑼灣興發街一號","WAN CHAI","灣仔","PARK, HARD-SURFACE PITCHES, BOWLING GREENS, TENNIS COURTS, BASKETBALL COURTS, JOGGING TRACKS/FITNESS TRAILS, OPEN AIR THEATRES, MODEL BOAT POOLS","公園, 硬地球場, 草地滾球場, 網球場, 籃球場, 緩跑徑/健身徑, 露天劇場, 模型船池","24 hours","24小時","2890 5824","2890 5824","2882 4151","2882 4151","vp@lcsd.gov.hk","vp@lcsd.gov.hk","http://www.lcsd.gov.hk/en/ls_park.php","http://www.lcsd.gov.hk/b5/ls_park.php","7-a-side soccer pitch","七人足球場","815965.0","837438.0","22.28256","114.18823","2018-12-03 14:43:49"
"nkboIzLtcU","Tennis Courts","Wan Tau Kok Playground","Wan Tau Kok Lane, Tai Po","網球場","運頭角遊樂場","大埔運頭角里","TAI PO","大埔","HARD-SURFACE PITCHES, TENNIS COURTS","硬地球場, 網球場","N.A.","N.A.","N.A.","N.A.","N.A.","N.A.","N.A.","N.A.","http://www.lcsd.gov.hk/en/facilities/facilitieslist.html","http://www.lcsd.gov.hk/tc/facilities/facilitieslist.html","5-a-side soccer pitch","5人足球場","834030.2","835486.2","22.4457","114.16928","2009-09-21 14:55:35"
"9r9fhG3Vwe","Tennis Courts","Wo Hing Sports Centre","8 Wo Ming Lane, Fanling","網球場","和興體育館","粉嶺和明里8號","NORTH","北區","BASKETBALL COURTS,VOLLEYBALL COURTS,BADMINTON COURTS,TENNIS COURTS,ACTIVITY ROOMS,FITNESS ROOMS,SQUASH COURTS,TABLE TENNIS TABLES,AMERICAN POOL TABLES","籃球場,排球場,羽毛球場,網球場,活動室,健身室,壁球場,乒乓球檯,美式桌球檯","N.A.","N.A.","N.A.","N.A.","N.A.","N.A.","N.A.","N.A.","http://www.lcsd.gov.hk/en/facilities/facilitieslist/landsports/sportcentre.html","http://www.lcsd.gov.hk/tc/facilities/facilitieslist/landsports/sportcentre.html","N.A.","N.A.","838355.0","832796.0","22.48475","114.14314","2010-01-13 18:41:45"
"14XpBlm0Ka","Tennis Courts","Wu Shan Tennis Courts","Wu Shan Road, Tuen Mun","網球場","湖山網球場","屯門湖山路","TUEN MUN","屯門","N.A.","N.A.","","","","","","","","","http://www.lcsd.gov.hk/en/facilities/facilitieslist/landsports/tennis.html","http://www.lcsd.gov.hk/tc/facilities/facilitieslist/landsports/tennis.html","N.A.","N.A.","826388.0","814750.0","22.37655","113.96794","2009-09-21 14:15:15"
"gAPWsw8L66","Tennis Courts","Yuen Wo Playground","16 Yuen Wo Road, Sha Tin","網球場","源禾遊樂場","沙田源禾路16號","SHA TIN","沙田","HARD-SURFACE PITCHES, VOLLEYBALL COURTS, TENNIS COURTS, HANDBALL COURTS, JOGGING TRACKS/FITNESS TRAILS","硬地球場, 排球場, 網球場, 手球場, 緩跑徑/健身徑","N.A.","N.A.","N.A.","N.A.","N.A.","N.A.","N.A.","N.A.","http://www.lcsd.gov.hk/en/facilities/facilitieslist.html","http://www.lcsd.gov.hk/tc/facilities/facilitieslist.html","7-a-side soccer pitch","7人足球場","827373.0","838178.0","22.38558","114.19542","2009-10-29 17:29:57"
